{
  "request_id": "req_demo_001",
  "submission_id": "sub_demo_001",
  "revision_id": "rev_demo_001",
  "channel": "linkedin",
  "text": "Flow Pilot offers a 30-day free trial. Security is 100% guaranteed! Our uptime is 99.999% uptime.",
  "knowledge": {
    "brand_id": "brand_flowpilot",
    "knowledge_version_id": "kv_demo_001",
    "version_no": 1,
    "activated_at": "2026-10-25T00:00:00Z",
    "voice_traits": [
      "friendly",
      "professional",
      "precise"
    ],
    "sources": [
      {
        "id": "src_trial",
        "title": "Demo Trial Policy",
        "excerpt": "FlowPilot offers a 14-day free trial.",
        "valid_until": null
      },
      {
        "id": "src_names",
        "title": "Demo Brand Guide",
        "excerpt": "Official product spelling: FlowPilot.",
        "valid_until": null
      }
    ],
    "rules": [
      {
        "id": "rule_name",
        "type": "terminology",
        "pattern": "Flow Pilot",
        "replacement": "FlowPilot",
        "severity": "warning",
        "source_id": "src_names"
      },
      {
        "id": "rule_guarantee",
        "type": "restricted_phrase",
        "pattern": "100% guaranteed",
        "replacement": null,
        "severity": "blocker",
        "source_id": null
      }
    ],
    "claims": [
      {
        "id": "claim_trial",
        "fact_key": "free_trial_days",
        "value": 14,
        "unit": "days",
        "approved_text": "14-day free trial",
        "source_id": "src_trial"
      }
    ]
  },
  "ai_enabled": false
}